{
  "schema_version": "1.0",
  "generated_at": "2026-07-03T21:31:40.580284+08:00",
  "slot": "us-pre",
  "slot_label": "美股盤前",
  "trading_day": "2026-07-03",
  "market_status": {
    "tw": "closed",
    "us": "holiday"
  },
  "indices": [],
  "macro": {
    "futures": []
  },
  "sectors": {
    "US": [],
    "TW": [],
    "TW_sub": [],
    "TW_chains": []
  },
  "highlights": {
    "strongest_sector": null,
    "sector_leaders": [],
    "top_gainers": [],
    "top_losers": []
  },
  "crypto": [],
  "news": [],
  "errors": []
}